_id,id,_idpropertyType,_t_propertyTypeMeta,_idtype,_t_typeMeta,subtype,internalName,status,deff_curr,instantBooking
604e42ff500e5de7df1a1e11,PJ01G,5ae04e1022261d03ab814d61,"{'_mstitle': {'pt_BR': 'Apartamento', 'en_US': 'Apartment', 'de_DE': 'Ferienwohnung', 'es_ES': 'Departamento', 'pt_PT': 'Apartamento'}}",5ab8f8a2f6b2dc2e97f97050,"{'_mstitle': {'pt_BR': 'Apartamento', 'en_US': 'Apartment', 'de_DE': 'Ferienwohnung', 'es_ES': 'Departamento', 'pt_PT': 'Apartamento'}}",entire_home,TST001,hidden,BRL,True
604fa4aa99f210117939f41f,PK01G,5ae04e1022261d03ab814d61,"{'_mstitle': {'pt_BR': 'Apartamento', 'en_US': 'Apartment', 'de_DE': 'Ferienwohnung', 'es_ES': 'Departamento', 'pt_PT': 'Apartamento'}}",5ab8f8a2f6b2dc2e97f97050,"{'_mstitle': {'pt_BR': 'Apartamento', 'en_US': 'Apartment', 'de_DE': 'Ferienwohnung', 'es_ES': 'Departamento', 'pt_PT': 'Apartamento'}}",entire_home,TST002,hidden,BRL,True
604fa4f6c46b506d633753bf,PK02G,5ae04e1022261d03ab814d61,"{'_mstitle': {'pt_BR': 'Apartamento', 'en_US': 'Apartment', 'de_DE': 'Ferienwohnung', 'es_ES': 'Departamento', 'pt_PT': 'Apartamento'}}",5ab8f8a2f6b2dc2e97f97050,"{'_mstitle': {'pt_BR': 'Apartamento', 'en_US': 'Apartment', 'de_DE': 'Ferienwohnung', 'es_ES': 'Departamento', 'pt_PT': 'Apartamento'}}",entire_home,TST003,hidden,BRL,True
5fc7bd3e7211848967eaa210,LL02G,5ae04e1022261d03ab814d77,"{'_mstitle': {'pt_BR': 'Acomodação móvel', 'en_US': 'Mobile accommodation', 'es_ES': 'Acomodación móvil', 'pt_PT': 'Acomodação móvel'}}",5ab8f8a2f6b2dc2e97f97050,"{'_mstitle': {'pt_BR': 'Apartamento', 'en_US': 'Apartment', 'de_DE': 'Ferienwohnung', 'es_ES': 'Departamento', 'pt_PT': 'Apartamento'}}",entire_home,ELU101,"{'pt_BR': 'Studio novo e confortável, perto da praia - ELU101'}","{'pt_BR': '<p>Lindo estúdio com excelente localização em Jurerê, a menos de 5min a pé da beira da praia e com diversas opções de serviço e comércio em um raio de 300m. <br> <br>O estúdio é aconchegante e bem equipado, com móveis e utensílios novos, perfeito para casais que buscam conforto e comodidade. <br> <br>Condomínio novo com piscina, academia e garagem. <br> <br>IMPORTANTE: Para check-in após as 20h há cobrança adicional de taxa de conveniência, então é preciso consultar valores e forma de pagamento com o anfitrião :)</p><p>Para o conforto de nossos hóspedes, o studio possui: <br> <br>- 1 cama de casal queen size; <br>- Ar condicionado; <br>- 1 banheiro social; <br>- 1 TV; <br>- Wifi disponível; <br>- Cozinha completa com fogão, geladeira, microondas, chaleira elétrica, sanduicheira, cafeteira, liquidificador, utensílios domésticos e panelas; <br>- Produtos de higiene e cuidado pessoal (sabonete, shampoo e papel higiênico); <br>- Roupas de cama e banho de qualidade hoteleira (roupas de cama extra são cobrados pela Seazone); <br>- Vaga de garagem; <br>- Condomínio com academia e piscina com vista para o mar. <br> <br>Venha, relaxe, divirta-se e não se preocupe com mais nada :)<br></p>'}",active,2,1,1,1,"{'countryCode': 'BR', 'state': 'Santa Catarina', 'stateCode': 'SC', 'city': 'Florianópolis', 'region': 'Jurerê', 'street': 'Rua Professor Renato Barbosa', 'streetNumber': '227', 'additional': '101', 'zip': '88053-640'}","{'_f_lat': -27.440659, '_f_lng': -48.48489}",BRL,601879e316e0b6314ee8e3f4,{'url': 'https://reservas.seazone.com.br/image/d235/601879e316e0b6314ee8e3f4'},True
5fe38946114e07ccf399432e,MG02G,5ae04e1022261d03ab814d82,"{'_mstitle': {'pt_BR': 'Casa', 'en_US': 'House', 'es_ES': 'Casa', 'pt_PT': 'Casa'}}",5ab8f8a2f6b2dc2e97f9704f,"{'_mstitle': {'pt_BR': 'Estúdio', 'en_US': 'Studio', 'de_DE': 'Studio', 'es_ES': 'Estudio', 'pt_PT': 'Estúdio'}}",entire_home,ATL018,"{'pt_BR': 'Ateliê aconchegante em meio à natureza ATL018', 'en_US': 'Cozy studio in the middle of nature ATL018', 'es_ES': 'Acogedor estudio en plena naturaleza ATL018'}","{'pt_BR': '<p>Lindo studio muito aconchegante e privativo com cama queen, split, Smart TV, mini cozinha e banheiro. O lugar perfeito para casais passarem dias inesquecíveis! <br> <br>Localizado em condomínio fechado com ampla área verde, a 20min a pé da beira da praia através de uma linda trilha com acesso pelo condomínio. <br> <br>* Piscina e pátio compartilhados com a casa principal. <br> <br>IMPORTANTE: Para check-in após as 20h há cobrança adicional de taxa de conveniência, então é preciso consultar valores e forma de pagamento com o anfitrião :) <br> <br> <br>Para o conforto de nossos hóspedes, o studio possui: <br> <br>- 1 cama de casal queen size muito confortável com colchão de molas; <br>- Ar-condicionado split novo; <br>- Espaço de estar com sofá, Smart TV nova e mesa com 2 cadeiras; <br>- 1 banheiro; <br>- Minicozinha com frigobar, fogão de indução, microondas, forno elétrico, chaleira elétrica, sanduicheira, liquidificador, panelas e utensílios; <br>- Wi-fi de 240MB; <br>- Tela com barreira para mosquitos em todas as janelas; <br>- Grande jardim (compartilhados com a casa principal); <br>- Condomínio seguro com churrasqueira* e muita área verde; <br>- Ótima localização com minimercado, padaria, sorveteria e farmácia em frente ao condomínio; <br>- Caminho para a praia através de uma linda trilha (menos de 20min da casa até o mar), com acesso por dentro do condomínio. <br> <br>*Uso da churrasqueira mediante reserva. <br>*Piscina não disponível para uso no período de 28/12/2021 a 08/01/2022. <br><br>Venha, relaxe, divirta-se e não se preocupe com mais nada :)<br></p>', 'en_US': ""<p>Beautiful studio very cozy and private with queen bed, split, Smart TV, mini kitchen and bathroom. The perfect place for couples to spend unforgettable days! <br> <br>Located in a gated community with ample green area, 20 minutes walk from the beach through a beautiful trail with access through the condominium. <br> <br>* Pool and patio shared with the main house. <br> <br>IMPORTANT: For check-in after 8pm there is an additional convenience fee charge, so you need to check values \u200b\u200band form of payment with the host :) <br> <br> <br>For the comfort of our guests, the studio has: <br> <br>- 1 queen size bed very comfortable with box spring mattress; <br>- New split air conditioning; <br>- Living space with sofa, new Smart TV and table with 2 chairs; <br>- 1 bathroom; <br>- Mini kitchen with fridge, induction hob, microwave, electric oven, electric kettle, sandwich maker, blender, pots and utensils; <br>- 240MB Wi-Fi; <br>- Screen with mosquito barrier on all windows; <br>- Large garden (shared with the main house); <br>- Safe condominium with barbecue * and lots of green area; <br>- Great location with mini market, bakery, ice cream shop and pharmacy in front of the condo; <br>- Way to the beach through a beautiful trail (less than 20 minutes from the house to the sea), with access from inside the condominium. <br> <br>* Use of the grill upon reservation. <br>* Swimming pool not available for use in the period from 12/28/2021 to 1/8/2022. <br> <br>Come, relax, have fun and don't worry about anything :)<br></p>"", 'es_ES': '<p>Hermoso estudio muy acogedor y privado con cama queen, split, Smart TV, mini cocina y baño. ¡El lugar perfecto para que las parejas pasen unos días inolvidables! <br> <br>Ubicado en una comunidad cerrada con amplia área verde, a 20 minutos caminando de la playa por un hermoso sendero con acceso a través del condominio. <br> <br>* Piscina y patio compartidos con la casa principal. <br> <br>IMPORTANTE: Para el check-in después de las 8:00 p. M., Hay un cargo adicional de tarifa de conveniencia, por lo que debe verificar los valores y la forma de pago con el anfitrión :) <br> <br> <br>Para la comodidad de nuestros huéspedes, el estudio cuenta con: <br> <br>- 1 cama queen size muy cómoda con colchón con somier; <br>- Nuevo aire acondicionado split; <br>- Sala de estar con sofá, Smart TV nuevo y mesa con 2 sillas; <br>- 1 baño; <br>- Mini cocina con nevera, placa de inducción, microondas, horno eléctrico, hervidor eléctrico, sandwichera, batidora, ollas y utensilios; <br>- 240 MB de Wi-Fi; <br>- Pantalla con barrera contra mosquitos en todas las ventanas; <br>- Gran jardín (compartido con la casa principal); <br>- Condominio seguro con parrilla * y mucha área verde; <br>- Excelente ubicación con mini mercado, panadería, heladería y farmacia frente al condominio; <br>- Camino a la playa por un hermoso sendero (a menos de 20 minutos de la casa al mar), con acceso desde el interior del condominio. <br> <br>* Uso de la parrilla con reserva. <br>* Piscina no disponible para su uso en el período del 28/12/2021 al 01/08/2022. <br> <br>Ven, relájate, diviértete y no te preocupes por nada :)<br></p>'}",active,2,1,1,1,"{'countryCode': 'BR', 'state': 'Santa Catarina', 'stateCode': 'SC', 'city': 'Florianópolis', 'region': 'Porto da Lagoa', 'street': 'Rodovia Antônio Luís Moura Gonzaga', 'streetNumber': '95', 'additional': '18', 'zip': '88062-477'}","{'_f_lat': -27.634367410986545, '_f_lng': -48.47103760797881}",BRL,60241c4f5eed62c17a082f66,{'url': 'https://reservas.seazone.com.br/image/d235/60241c4f5eed62c17a082f66'},True
60198294837487bc292bf781,NV01G,5ae04e1022261d03ab814d82,"{'_mstitle': {'pt_BR': 'Casa', 'en_US': 'House', 'es_ES': 'Casa', 'pt_PT': 'Casa'}}",5ab8f8a2f6b2dc2e97f9704f,"{'_mstitle': {'pt_BR': 'Estúdio', 'en_US': 'Studio', 'de_DE': 'Studio', 'es_ES': 'Estudio', 'pt_PT': 'Estúdio'}}",entire_home,AGAC5402,{'pt_BR': 'Studio com vista para Lagoa da Conceição AGAC5402'},"{'pt_BR': '<p>Studio completo com linda vista para a Lagoa da Conceição, um dos principais cartões postais de Florianópolis. Localizado em meio à mata nativa, a apenas 1,5km do centrinho da Lagoa e a 15min de carro da Praia Mole ou da Joaquina <br> <br>Perfeito para casais que buscam um lugar tranquilo para passar dias inesquecíveis. <br> <br>IMPORTANTE: Para check-in após as 20h há cobrança adicional de taxa de conveniência, então é preciso consultar valores e forma de pagamento com o anfitrião :)</p><p><br></p><p>Para o conforto de nossos hóspedes, o studio possui: <br> <br>- 1 cama de casal, TV e ar condicionado; <br>- Cozinha compacta com frigobar, fogão elétrico de mesa, microondas, chaleira elétrica, liquidificador e utensílios; <br>- Mesa para refeições; <br>- Wifi disponível; <br>- Roupas de cama e banho de qualidade hoteleira (roupas de cama extra são cobrados pela Seazone); <br>- Espaço para estacionar o carro em frente à casa. <br> <br>Venha, relaxe, divirta-se e não se preocupe com mais nada :)<br></p>'}",active,2,1,1,1,"{'countryCode': 'BR', 'state': 'Santa Catarina', 'stateCode': 'SC', 'city': 'Florianópolis', 'region': 'Lagoa da Conceição', 'street': 'Rodovia Admar Gonzaga', 'streetNumber': '5402', 'additional': 'Studio C', 'zip': '88062-001'}","{'_f_lat': -27.6003607, '_f_lng': -48.477293}",BRL,6021dbba9a4f2b701c7635ea,{'url': 'https://reservas.seazone.com.br/image/d235/6021dbba9a4f2b701c7635ea'},True
60198b838374874a082bf9c0,NV02G,5ae04e1022261d03ab814d82,"{'_mstitle': {'pt_BR': 'Casa', 'en_US': 'House', 'es_ES': 'Casa', 'pt_PT': 'Casa'}}",5ab8f8a2f6b2dc2e97f9704f,"{'_mstitle': {'pt_BR': 'Estúdio', 'en_US': 'Studio', 'de_DE': 'Studio', 'es_ES': 'Estudio', 'pt_PT': 'Estúdio'}}",entire_home,AGAB5402,{'pt_BR': 'Studio aconchegante em meio à mata nativa AGAB5402'},"{'pt_BR': '<p>Studio completo em meio à mata nativa, a apenas 1,5km do centrinho da Lagoa e a 15min de carro da Praia Mole ou da Joaquina. <br> <br>Perfeito para casais que buscam um lugar tranquilo para passar dias inesquecíveis. <br> <br>IMPORTANTE: Para check-in após as 20h há cobrança adicional de taxa de conveniência, então é preciso consultar valores e forma de pagamento com o anfitrião :)</p><p><br></p><p>Para o conforto de nossos hóspedes, o studio possui: <br> <br>- 1 cama de casal, TV e ventilador; <br>- Cozinha compacta com frigobar, fogão cooktop, microondas, , liquidificador e utensílios; <br>- Mesa para refeições; <br>- Wifi disponível; <br>- Roupas de cama e banho de qualidade hoteleira (roupas de cama extra são cobrados pela Seazone); <br>- Espaço para estacionar o carro em frente à casa. <br> <br>Venha, relaxe, divirta-se e não se preocupe com mais nada :)<br></p>'}",active,2,1,1,1,"{'countryCode': 'BR', 'state': 'Santa Catarina', 'stateCode': 'SC', 'city': 'Florianópolis', 'region': 'Lagoa da Conceição', 'street': 'Rodovia Admar Gonzaga', 'streetNumber': '5402', 'additional': 'Studio B', 'zip': '88062-001'}","{'_f_lat': -27.6003607, '_f_lng': -48.477293}",BRL,6021d9d79a4f2b4c9f763545,{'url': 'https://reservas.seazone.com.br/image/d235/6021d9d79a4f2b4c9f763545'},True
605cb7b6ce0749bc65a07c12,PU01G,5ae04e1022261d03ab814d82,"{'_mstitle': {'pt_BR': 'Casa', 'en_US': 'House', 'es_ES': 'Casa', 'pt_PT': 'Casa'}}",5ab8f8a2f6b2dc2e97f97054,"{'_mstitle': {'en_US': 'Chalet', 'pt_BR': 'Chalé', 'es_ES': 'Chalet', 'pt_PT': 'Chalé'}}",entire_home,MAV001,"{'pt_BR': 'Chalé com vista mar 300m da praia em Jurerê MAV001', 'en_US': 'Chalet sea view 300m from beach in Jurerê MAV001', 'es_ES': 'Chalet con vista mar 300m de playa en JurerêMAV001'}","{'pt_BR': '<p>Chalé confortável e aconchegante com excelente localização em Jurerê Tradicional. Ideal para casais passarem dias inesquecíveis. Conta com cama de casal, TV, ar-condicionado e área comum de lazer com jacuzzi com bela vista para o mar. <br> <br>Localizado a 300 m da praia, próximo a restaurantes, bares, lojas, supermercados e comércio em geral. <br> <br>IMPORTANTE: Para check-in após as 20h há cobrança adicional de taxa de conveniência, então é preciso consultar valores e forma de pagamento com o anfitrião :)</p><p>Para o conforto de nossos hóspedes, o chalé possui: <br> <br>- 1 quarto com cama de casal, TV e ar-condicionado; <br>- 1 banheiro; <br>- Sala com cozinha compacta com fogão cooktop, frigobar e itens de cozinha; <br>- Mesa tipo bistrô com duas cadeiras; <br>- WI-FI disponível; <br>- Roupas de cama e banho de qualidade hoteleira (roupas de cama extra são cobrados pela Seazone); <br> <br>Para maior comodidade, os hóspedes têm à disposição espaço de lazer com jacuzzi e churrasqueira*. <br> <br>* Uso das áreas comuns: das 10h às 19h. <br>* A churrasqueira deve ser reservada com o anfitrião. <br> <br>Outras informações: <br>* A limpeza é realizada no check-out. Se o hóspede desejar uma limpeza extra será cobrado uma taxa de limpeza. <br>* São disponibilizadas uma toalha de banho por hóspede e uma toalha de rosto por banheiro, além de lençóis para a quantidade de hóspedes indicada, trocas de enxoval podem ser solicitadas ao valor de meia taxa de limpeza. <br> <br>Venha, relaxe, divirta-se e não se preocupe com mais nada :)<br></p>', 'en_US': ""<p>Comfortable and cozy chalet with excellent location in Jurerê Traditional. Ideal for couples to spend unforgettable days, it has a double bed, TV, air conditioning and a leisure area with a jacuzzi with a beautiful view of the beach. <br> <br>Located 300 m from the beach, close to restaurants, bars, shops, supermarkets and commerce in general. <br> <br>IMPORTANT: For check-in after 8pm there is an additional convenience fee charge, so you need to check values and form of payment with the host :)</p><p><br></p><p>For the comfort of our guests, the chalet has: <br> <br>- 1 bedroom with double bed, TV and air conditioning; <br>- 1 Bathroom; <br>- Open concept living space; <br>- Compact kitchen with cooktop, fridge, kitchen items; <br>- Table with two chairs; <br>- WI-FI available; <br>- Hotel quality bed and bath linen (extra bed linen is charged by Seazone); <br> <br>- For added convenience, guests have at their disposal leisure space: <br>- Jacuzzi * <br> <br>* In order to use the leisure space, you must consult availability with the host. <br> <br>* Cleaning is carried out at check-out. If the guest wishes an extra cleaning, a cleaning fee will be charged. <br>* A bath towel per guest and a face towel per bathroom are provided, in addition to sheets for the number of guests indicated, trousseau changes can be requested for a half cleaning fee. <br> <br>Come, relax, have fun and don't worry about anything else :)<br></p>"", 'es_ES': '<p>Chalet confortable y acogedor con excelente ubicación en Jurerê Tradicional. Ideal para que las parejas pasen unos días inolvidables, cuenta con una cama doble, TV, aire acondicionado y una zona de ocio con jacuzzi. <br> <br>Situado a 300 m de la playa, cerca de restaurantes, bares, tiendas, supermercados. <br> <br>IMPORTANTE: Para el check-in después de las 8:00 p. M. Hay un cargo adicional de tarifa de conveniencia, por lo que debe verificar los valores y la forma de pago con el anfitrión :)</p><p><br></p><p>Para la comodidad de nuestros huéspedes, el chalet cuenta con: <br> <br>- 1 dormitorio con cama doble, TV y aire acondicionado; <br>- 1 baño; <br>- Espacio habitable de concepto abierto; <br>- Cocina compacta con vitrocerámica, nevera, menaje de cocina; <br>- Mesa con dos sillas; <br>- WI-FI disponible; <br>- Ropa de cama y de baño de calidad hotelera (la ropa de cama adicional corre a cargo de Seazone); <br> <br>- Para mayor comodidad, los huéspedes tienen a su disposición espacios de ocio: <br>- Jacuzzi * <br> <br>* Para utilizar el espacio de ocio, debe consultar disponibilidad con el anfitrión. <br> <br>* La limpieza se realiza en el check-out, si el huésped desea una limpieza extra, se le cobrará una tarifa de limpieza. <br>* Se proporciona una toalla de baño por huésped y una toalla facial por baño, además de sábanas para el número de huéspedes indicado, se pueden solicitar cambios de ajuar por una media tasa de limpieza. <br> <br>Ven, relájate, diviértete y no te preocupes por nada más :)<br></p>'}",active,2,1,1,1,"{'countryCode': 'BR', 'state': 'Santa Catarina', 'stateCode': 'SC', 'city': 'Florianópolis', 'region': 'Jurerê', 'street': 'Rod. Tertuliano Brito Xavier', 'streetNumber': '3415', 'additional': 'Malaio Village', 'zip': '88054-601'}","{'_f_lat': -27.438545, '_f_lng': -48.480314}",BRL,605cbf01032ba012c1b334a1,{'url': 'https://reservas.seazone.com.br/image/d235/605cbf01032ba012c1b334a1'},True
605cba6ece07493b1ba07cda,PU02G,5ae04e1022261d03ab814d82,"{'_mstitle': {'pt_BR': 'Casa', 'en_US': 'House', 'es_ES': 'Casa', 'pt_PT': 'Casa'}}",5ab8f8a2f6b2dc2e97f97054,"{'_mstitle': {'en_US': 'Chalet', 'pt_BR': 'Chalé', 'es_ES': 'Chalet', 'pt_PT': 'Chalé'}}",entire_home,MAV002,"{'pt_BR': 'Aconchegante chalé com vista mar em Jurerê MAV002', 'en_US': 'Cozy chalet with sea view in Jurerê MAV002', 'es_ES': 'Acogedor chalet con vistas al mar en Jurerê MAV002'}","{'pt_BR': '<p>Chalé confortável e aconchegante com excelente localização em Jurerê Tradicional. Ideal para casais passarem dias inesquecíveis. Conta com cama de casal, TV, ar-condicionado e área comum de lazer com jacuzzi com bela vista para o mar. <br> <br>Localizado a 300 m da praia, próximo a restaurantes, bares, lojas, supermercados e comércio em geral. <br> <br>IMPORTANTE: Para check-in após as 20h há cobrança adicional de taxa de conveniência, então é preciso consultar valores e forma de pagamento com o anfitrião :)<br><br></p><p>Para o conforto de nossos hóspedes, o chalé possui: <br> <br>- 1 quarto com cama de casal, TV e ar-condicionado; <br>- 1 banheiro; <br>- Sala com cozinha compacta com fogão cooktop, frigobar e itens de cozinha; <br>- Mesa tipo bistrô com duas cadeiras; <br>- WI-FI disponível; <br>- Roupas de cama e banho de qualidade hoteleira (roupas de cama extra são cobrados pela Seazone); <br> <br>Para maior comodidade, os hóspedes têm à disposição espaço de lazer com jacuzzi e churrasqueira*. <br> <br>* Uso das áreas comuns: das 10h às 19h. <br>* A churrasqueira deve ser reservada com o anfitrião. <br> <br>Outras informações: <br>- A limpeza é realizada no check-out. Se o hóspede desejar uma limpeza extra será cobrado uma taxa de limpeza. <br>- São disponibilizadas uma toalha de banho por hóspede e uma toalha de rosto por banheiro, além de lençóis para a quantidade de hóspedes indicada, trocas de enxoval podem ser solicitadas ao valor de meia taxa de limpeza. <br> <br>Venha, relaxe, divirta-se e não se preocupe com mais nada :)<br></p>', 'en_US': ""<p>Comfortable and cozy chalet with excellent location in Jurerê Traditional. Ideal for couples to spend unforgettable days, it has a double bed, TV, air conditioning and a leisure area with a jacuzzi with a beautiful view of the beach. <br> <br>Located 300 m from the beach, close to restaurants, bars, shops, supermarkets and commerce in general. <br> <br>IMPORTANT: For check-in after 8pm there is an additional convenience fee charge, so you need to check values and form of payment with the host :)</p><p><br></p><p>For the comfort of our guests, the chalet has: <br> <br>- 1 bedroom with double bed, TV and air conditioning; <br>- 1 Bathroom; <br>- Open concept living space; <br>- Compact kitchen with cooktop, fridge, kitchen items; <br>- Table with two chairs; <br>- WI-FI available; <br>- Hotel quality bed and bath linen (extra bed linen is charged by Seazone); <br> <br>- For added convenience, guests have at their disposal leisure space: <br>- Jacuzzi * <br> <br>* In order to use the leisure space, you must consult availability with the host. <br> <br>* Cleaning is carried out at check-out. If the guest wishes an extra cleaning, a cleaning fee will be charged. <br>* A bath towel per guest and a face towel per bathroom are provided, in addition to sheets for the number of guests indicated, trousseau changes can be requested for a half cleaning fee. <br> <br>Come, relax, have fun and don't worry about anything else :)<br></p>"", 'es_ES': '<p>Chalet confortable y acogedor con excelente ubicación en Jurerê Tradicional. Ideal para que las parejas pasen unos días inolvidables, cuenta con una cama doble, TV, aire acondicionado y una zona de ocio con jacuzzi. <br> <br>Situado a 300 m de la playa, cerca de restaurantes, bares, tiendas, supermercados. <br> <br>IMPORTANTE: Para el check-in después de las 8:00 p. M. Hay un cargo adicional de tarifa de conveniencia, por lo que debe verificar los valores y la forma de pago con el anfitrión :)</p><p><br></p><p>Para la comodidad de nuestros huéspedes, el chalet cuenta con: <br> <br>- 1 dormitorio con cama doble, TV y aire acondicionado; <br>- 1 baño; <br>- Espacio habitable de concepto abierto; <br>- Cocina compacta con vitrocerámica, nevera, menaje de cocina; <br>- Mesa con dos sillas; <br>- WI-FI disponible; <br>- Ropa de cama y de baño de calidad hotelera (la ropa de cama adicional corre a cargo de Seazone); <br> <br>- Para mayor comodidad, los huéspedes tienen a su disposición espacios de ocio: <br>- Jacuzzi * <br> <br>* Para utilizar el espacio de ocio, debe consultar disponibilidad con el anfitrión. <br> <br>* La limpieza se realiza en el check-out, si el huésped desea una limpieza extra, se le cobrará una tarifa de limpieza. <br>* Se proporciona una toalla de baño por huésped y una toalla facial por baño, además de sábanas para el número de huéspedes indicado, se pueden solicitar cambios de ajuar por una media tasa de limpieza. <br> <br>Ven, relájate, diviértete y no te preocupes por nada más :)<br></p>'}",active,2,1,1,1,"{'countryCode': 'BR', 'state': 'Santa Catarina', 'stateCode': 'SC', 'city': 'Florianópolis', 'region': 'Jurerê', 'street': 'Rod. Tertuliano Brito Xavier', 'streetNumber': '3415', 'additional': 'Malaio Village', 'zip': '88054-601'}","{'_f_lat': -27.438545, '_f_lng': -48.480314}",BRL,605cc476ce07493200a07ec4,{'url': 'https://reservas.seazone.com.br/image/d235/605cc476ce07493200a07ec4'},True
