_id,id,_idpropertyType,_t_propertyTypeMeta,_idtype,_t_typeMeta,subtype,internalName,status,deff_curr,instantBooking
60673de5f3c76e1f8442b05b,QC02G,605e11cd73c436a3a917f7ce,"{'_mstitle': {'pt_BR': 'Pousada', 'en_US': 'Guest House', 'de_DE': 'Guest House', 'es_ES': 'Hostales y pensiones', 'pt_PT': 'Casa de hóspede'}}",5ab8f8a2f6b2dc2e97f9704f,"{'_mstitle': {'pt_BR': 'Estúdio', 'en_US': 'Studio', 'de_DE': 'Studio', 'es_ES': 'Estudio', 'pt_PT': 'Estúdio'}}",entire_home,PATY006,"{'pt_BR': 'Suíte com sacada/jacuzzi pousada em Jurerê PATY006', 'en_US': 'Suite with jacuzzi in inn in Jurerê PATY006', 'es_ES': 'Suite con balcón/jacuzzi pousada en Jurerê PATY006'}","{'pt_BR': '<p>Suíte ampla confortável e aconchegante com sacada e jacuzzi privativa (quente e frio) e com café da manhã de cortesia. Com excelente localização em Jurerê Tradicional, ideal para casais passarem dias inesquecíveis em maravilhosa pousada. <br> <br>A suíte está localizada a 240 metros da praia e a região conta com comércios diversos. Para maior comodidade de nossos hóspedes a pousada conta com bar e excelente bistrô.</p><p><br></p><p>Para o conforto de nossos hóspedes, a suíte possui: <br> <br>- 1 cama de casal e ar-condicionado; <br>- Smart TV com canais a cabo; <br>- Cortinas blackout; <br>- Sacada; <br>- Armário/comoda; <br>- Frigobar; <br>- Suporte para mala; <br>- Cabideiro; <br>- Secador de cabelo; <br>- Jacuzzi privativa (quente e frio); <br>- Produtos de higiene e cuidado pessoal (sabonete, shampoo e papel higiênico); <br>- Roupas de cama e banho de qualidade hoteleira (roupas de cama extra são cobrados pela Seazone); <br>- WI-FI disponível. <br> <br>Os hóspedes também terão à sua disposição: <br> <br>- Café da manhã de cortesia; <br>- Bistrô; <br>- Bar; <br>- Jacuzzi; <br>- Pátio cercado com móveis externos. <br> <br>* Suíte fica no segundo andar da pousada com possibilidade de locar junto com a suíte 05 e compartilhar a jacuzzi, para grupos de amigos ou famílias. <br> <br>* Não cobramos taxa de limpeza. A limpeza é realizada somente no check-out e se o hóspede desejar uma limpeza extra durante a estadia, será cobrado valor de R$ 20,00 por dia. <br> <br>* São disponibilizadas uma toalha de banho por hóspede e uma toalha de rosto por banheiro, além de lençóis para a quantidade de hóspedes indicada, trocas de enxoval podem ser solicitadas ao valor de meia taxa de limpeza. <br> <br>Venha, relaxe, divirta-se e não se preocupe com mais nada :)<br></p>', 'en_US': ""<p>Large comfortable and cozy suite with balcony and private jacuzzi (hot and cold) and with complimentary breakfast. With an excellent location in Jurerê Traditional, ideal for couples to spend unforgettable days in a wonderful inn. <br> <br>The suite is located 240 meters from the beach and the region has several shops. For the convenience of our guests, the inn has a bar and an excellent bistro.</p><p><br></p><p>For the comfort of our guests, the suite has: <br> <br>- 1 double bed and air conditioning; <br>- Smart TV with cable channels; <br>- Blackout curtains; <br>- Balcony; <br>- Closet / dresser; <br>- Minibar; <br>- Suitcase support; <br>- Clothes rack; <br>- Hair dryer; <br>- Private jacuzzi (hot and cold); <br>- Hygiene and personal care products (soap, shampoo and toilet paper); <br>- Hotel quality bed and bath linen (extra bed linen is charged by Seazone); <br>- WI-FI available. <br> <br>Guests will also have at their disposal: <br> <br>- Complimentary breakfast; <br>- Bistro; <br>- Pub; <br>- Jacuzzi; <br>- Fenced courtyard with external furniture. <br> <br>* Suite is on the second floor of the inn with the possibility of renting together with suite 05 and sharing the jacuzzi, for groups of friends or families. <br> <br>* We do not charge a cleaning fee. Cleaning is carried out only at check-out and if the guest wishes an extra cleaning during the stay, a fee of R$ 20.00 per day will be charged. <br> <br>* A bath towel per guest and a face towel per bathroom are provided, in addition to sheets for the number of guests indicated, trousseau changes can be requested for a half cleaning fee. <br> <br>Come, relax, have fun and don't worry about anything :)<br></p>"", 'es_ES': '<p>Amplia suite cómoda y acogedora con balcón y jacuzzi privado (frío y caliente) y con desayuno de cortesía. Con una excelente ubicación en Jurerê Tradicional, ideal para que las parejas pasen unos días inolvidables en una maravillosa posada. <br> <br>La suite se encuentra a 240 metros de la playa y la región cuenta con varias tiendas. Para comodidad de nuestros huéspedes, la posada cuenta con un bar y un excelente bistró.</p><p><br></p><p>Para la comodidad de nuestros huéspedes, la suite cuenta con: <br> <br>- 1 cama doble y aire acondicionado; <br>- Smart TV con canales por cable; <br>- Cortinas opacas; <br>- Balcón <br>- Armario / tocador; <br>- Minibar <br>- Soporte de maleta; <br>- Tendedero; <br>- Secador de pelo; <br>- Jacuzzi privado (frío y caliente); <br>- Productos de higiene y cuidado personal (jabón, champú y papel higiénico); <br>- Ropa de cama y de baño de calidad hotelera (la ropa de cama adicional corre a cargo de Seazone); <br>- wifi disponible. <br> <br>Los huéspedes también tendrán a su disposición: <br> <br>- Desayuno complementario; <br>- Bistró; <br>- Pub; <br>- Jacuzzi; <br>- Patio vallado con mobiliario exterior. <br> <br>* La suite se encuentra en el segundo piso de la posada con posibilidad de alquilar junto con la suite 05 y compartir el jacuzzi, para grupos de amigos o familias. <br> <br>* No cobramos tarifa de limpieza. La limpieza se realiza solo en el check-out y si el huésped desea una limpieza adicional durante la estancia, se cobrará una tarifa de R $ 20,00 por día. <br> <br>* Se proporciona una toalla de baño por huésped y una toalla facial por baño, además de sábanas para el número de invitados indicado, se pueden solicitar cambios de ajuar por una media tasa de limpieza. <br> <br>Ven, relájate, diviértete y no te preocupes por nada más :)<br></p>'}",active,2,1,1,1,"{'countryCode': 'BR', 'state': 'Santa Catarina', 'stateCode': 'SC', 'city': 'Florianópolis', 'region': 'Jurerê Tradicional', 'street': 'R. Jorge Cherem', 'streetNumber': '95', 'additional': 'Suíte 6', 'zip': '88053-620'}","{'_f_lat': -27.4396767, '_f_lng': -48.4854616}",BRL,60673fe7f3c76e130242b0f8,{'url': 'https://reservas.seazone.com.br/image/d235/60673fe7f3c76e130242b0f8'},True
5d51a18608eac6001040e0d2,TB01F,5db7449afe23d30011730e41,"{'_mstitle': {'en_US': 'Holiday resort', 'pt_BR': 'Resort de férias', 'es_ES': 'Estancia de vacaciones', 'pt_PT': 'Estância de férias'}}",5ab8f8a2f6b2dc2e97f9704f,"{'_mstitle': {'pt_BR': 'Estúdio', 'en_US': 'Studio', 'de_DE': 'Studio', 'es_ES': 'Estudio', 'pt_PT': 'Estúdio'}}",entire_home,JBV134,"{'pt_BR': 'Estúdio vista mar e piscina Resort Pé na Areia JBV134', 'en_US': 'Sea View Pool and Studio Resort Foot in the Sand JBV134', 'es_ES': 'Piscina con vista al mar y Studio Resort Foot in the Sand JBV134'}","{'pt_BR': '<p>Relaxar, desestressar e curtir em um dos lugares mais bonitos do Brasil.</p><p>A partir da sacada com vista lateral do mar e frente piscina, você pode curtir a brisa e a vista de um fim de tarde ou acordar e verificar se o dia está para praia ou para uma piscina aquecida.</p><p><br>Apartamento com localização perfeita para solteiros ou casais que gostam de curtir o movimento de bares e restaurantes sem precisar andar muito.</p><p><br>Ideal para trazer filhos pequenos e curtir a tranquilidade e benefícios de um resort.</p><p><br>O quarto é extremamente confortável, silencioso e relaxante.</p><p><br>Para o conforto de nossos hóspedes, ele possui:</p><p>- 2 Camas de solteiro convertíveis para uma de casal</p><p>- 01 cama embutida de solteiro</p><p>- LED TV 40""</p><p>- Cozinha com Microondas e frigobar</p><p><br>O condomínio possui acesso direto à praia, com direito a guarda-sol e cadeiras.</p><p><br>Além disso, o hóspede pode usufruir dos seguintes benefícios do resort gratuitamente:</p><p>- Serviço de camareira diariamente</p><p>- Serviço exclusivo de concierge</p><p>- Extensa área de lazer com piscina externa aquecida e natural</p><p>- Sauna</p><p>- Jacuzzis</p><p>- Academia</p><p>- Sala de jogos</p><p>- Espaço kids, com monitores para crianças das 10 da manhã às 10 da noite<br></p><p>Há 3 restaurantes no hotel a disposição dos hóspedes, com bom custo-benefício.<br></p><p>Acesso liberado para todas áreas.<br></p><p>Outras observações<br></p><p>Café da manhã não está incluso!<br></p><p>Todas as despesas geradas com comidas e bebidas dos bares e restaurantes do hotel deverão ser pagas quando consumidas. O hotel não abre conta para pagar no check out.</p>', 'en_US': '<p>Relax, unwind and enjoy in one of the most beautiful places in Brazil.</p><p>From the sea-view balcony and pool front, you can enjoy the breeze and late-afternoon view or wake up and check if the day is for the beach or a heated pool.</p><p>Perfectly located apartment for singles or couples who like to enjoy the movement of bars and restaurants without having to walk too much.</p><p><br></p><p>Ideal for bringing small children and enjoying the tranquility and benefits of a resort.</p><p>The room is extremely comfortable, quiet and relaxing.</p><p><br></p><p>For the comfort of our guests, it features:</p><p><br></p><p>- 2 Single Beds Convertible to One Double</p><p>- 01 single built-in bed</p><p>- LED TV 40 ""</p><p>- Kitchen with microwave and fridge</p><p><br></p><p>The condominium has direct access to the beach, with umbrella and chairs.</p><p>In addition, you can enjoy the following resort benefits for free:</p><p><br></p><p>- Daily maid service</p><p>- Exclusive Concierge Service</p><p>- Extensive play area with heated outdoor natural pool</p><p>- Steam room</p><p>- Jacuzzis</p><p>- Gym</p><p>- Playroom</p><p>- Kids space with monitors for children from 10am to 10pm</p><p><br></p><p>There are 3 value-for-money restaurants at the hotel.</p><p><br></p><p>Access allowed for all areas.</p><p>Other remarks</p><p>Breakfast is not included!</p><p><br></p><p>All expenses incurred with food and drink in the hotel bars and restaurants must be paid when consumed. The hotel does not open bill to pay at check out.</p>', 'es_ES': '<p>Relájese, descanse y disfrute en uno de los lugares más bellos de Brasil.</p><p>Desde el balcón con vista al mar y al frente de la piscina, puede disfrutar de la brisa y la vista de la tarde o despertarse y verificar si el día es para la playa o una piscina climatizada.</p><p>Apartamento perfectamente ubicado para solteros o parejas que les gusta disfrutar del movimiento de bares y restaurantes sin tener que caminar demasiado.</p><p><br></p><p>Ideal para traer niños pequeños y disfrutar de la tranquilidad y los beneficios de un resort.</p><p><br></p><p>La habitación es extremadamente cómoda, tranquila y relajante.</p><p><br></p><p>Para la comodidad de nuestros huéspedes, presenta:</p><p>- 2 camas individuales convertibles en una doble</p><p>- 01 cama empotrada individual</p><p>- TV LED de 40 ""</p><p>- Cocina con microondas y nevera.</p><p><br></p><p>El condominio tiene acceso directo a la playa, con sombrilla y sillas.</p><p><br></p><p>Además, puede disfrutar de los siguientes beneficios del resort de forma gratuita:</p><p><br></p><p>- Servicio de limpieza diario</p><p>- Servicio exclusivo de conserjería</p><p>- Amplia área de juegos con piscina natural climatizada al aire libre</p><p>- Sauna</p><p>- Jacuzzis</p><p>- Academia</p><p>- Sala de juegos</p><p>- Espacio para niños con monitores para niños de 10 a.m. a 10 p.m.</p><p><br></p><p>Hay 3 restaurantes con buena relación calidad-precio en el hotel.</p><p><br></p><p>Acceso permitido para todas las áreas.</p><p>Otros comentarios</p><p>¡El desayuno no está incluido!</p><p>Todos los gastos incurridos con alimentos y bebidas en los bares y restaurantes del hotel deben pagarse cuando se consumen. El hotel no abre la factura para pagar en el check out.</p>'}",active,3,1,2,1,"{'countryCode': 'BR', 'state': 'Santa Catarina', 'stateCode': 'SC', 'city': 'Florianópolis', 'region': 'Jurerê', 'street': 'Alameda César Nascimento', 'streetNumber': '646', 'additional': 'Apto 124', 'zip': '88053-500'}","{'_f_lat': -27.4389433, '_f_lng': -48.4894253}",BRL,5e3aea125128df00102e23be,{'url': 'https://reservas.seazone.com.br/image/d235/5e3aea125128df00102e23be'},True
5d51a25e08eac6001040e681,TB24F,5db7449afe23d30011730e41,"{'_mstitle': {'en_US': 'Holiday resort', 'pt_BR': 'Resort de férias', 'es_ES': 'Estancia de vacaciones', 'pt_PT': 'Estância de férias'}}",5ab8f8a2f6b2dc2e97f9704f,"{'_mstitle': {'pt_BR': 'Estúdio', 'en_US': 'Studio', 'de_DE': 'Studio', 'es_ES': 'Estudio', 'pt_PT': 'Estúdio'}}",entire_home,JBV464,"{'pt_BR': 'Vista Mar Resort Pé na Areia - JBV464', 'en_US': 'Sea View Resort Foot in the Sand - JBV464', 'es_ES': 'Vista al mar Resort Foot en el Sand - JBV464'}","{'pt_BR': '<p>Relaxar, desestressar e curtir em um dos lugares mais bonitos do Brasil.<br></p><p>A partir da sacada com vista lateral do mar e frente piscina, você pode curtir a brisa e a vista de um fim de tarde ou acordar e verificar se o dia está para praia ou para uma piscina aquecida.<br></p><p>Apartamento com localização perfeita para solteiros ou casais que gostam de curtir o movimento de bares e restaurantes sem precisar andar muito.Ideal para trazer filhos pequenos e curtir a tranquilidade e benefícios de um resort.<br></p><p>O espaço:</p><p>O quarto é extremamente confortável, silencioso e relaxante.<br></p><p>Para o conforto de nossos hóspedes, ele possui:</p><p>- 2 Camas de solteiro convertíveis para uma de casal</p><p>- 01 cama embutida de solteiro</p><p>- LED TV 40""</p><p>- Cozinha com Microondas e frigobar</p><p><br>O condomínio possui acesso direto à praia, com direito a guarda-sol e cadeiras.</p><p><br>Além disso, o hóspede pode usufruir dos seguintes benefícios do resort gratuitamente:</p><p>- Serviço de camareira diariamente</p><p>- Serviço exclusivo de concierge</p><p>- Extensa área de lazer com piscina externa aquecida e natural</p><p>- Sauna</p><p>- Jacuzzis</p><p>- Academia</p><p>- Sala de jogos</p><p>- Espaço kids, com monitores para crianças das 10 da manhã às 10 da noite</p><p><br></p><p>Há 3 restaurantes no hotel a disposição dos hóspedes, com bom custo-benefício.</p><p><br>Acesso dos hóspedes:</p><p><br>Acesso liberado para todas áreas.</p><p><br>Outras observações</p><p><br>Café da manhã não está incluso!</p><p><br>Todas as despesas geradas com comidas e bebidas dos bares e restaurantes do hotel deverão ser pagas quando consumidas. O hotel não abre conta para pagar no check out.</p>', 'en_US': '<p>Relax, unwind and enjoy in one of the most beautiful places in Brazil.</p><p>From the sea-view balcony and pool front, you can enjoy the breeze and late-afternoon view or wake up and check if the day is for the beach or a heated pool.</p><p><br></p><p>Perfectly located apartment for singles or couples who like to enjoy the movement of bars and restaurants without having to walk a lot.</p><p>Ideal for bringing small children and enjoying the tranquility and benefits of a resort.</p><p><br></p><p>The space:</p><p>The room is extremely comfortable, quiet and relaxing.</p><p><br></p><p>For the comfort of our guests, it features:</p><p>- 2 Single Beds Convertible to One Double</p><p>- 01 single built-in bed</p><p>- LED TV 40 ""</p><p>- Kitchen with microwave and fridge</p><p><br></p><p>The condominium has direct access to the beach, with umbrella and chairs.</p><p><br></p><p>In addition, you can enjoy the following resort benefits for free:</p><p>- Daily maid service</p><p>- Exclusive Concierge Service</p><p>- Extensive play area with heated outdoor natural pool</p><p>- Steam room</p><p>- Jacuzzis</p><p>- Gym</p><p>- Playroom</p><p>- Kids space with monitors for children from 10am to 10pm</p><p><br></p><p>There are 3 value-for-money restaurants at the hotel.</p><p><br></p><p>Guest access:</p><p><br></p><p>Access allowed for all areas.</p><p><br></p><p>Other remarks</p><p><br></p><p>Breakfast is not included!</p><p><br></p><p>All expenses incurred with food and drink in the hotel bars and restaurants must be paid when consumed. The hotel does not open bill to pay at check out.</p>', 'es_ES': '<p>Relájese, descanse y disfrute en uno de los lugares más bellos de Brasil.</p><p><br></p><p>Desde el balcón con vista al mar y frente a la piscina, puede disfrutar de la brisa y la vista de la tarde o despertarse y verificar si el día es para la playa o una piscina climatizada.<br></p><p>Apartamento perfectamente ubicado para solteros o parejas que les gusta disfrutar del movimiento de bares y restaurantes sin tener que caminar mucho.Ideal para traer niños pequeños y disfrutar de la tranquilidad y los beneficios de un resort.</p><p><br></p><p>El espacio:La habitación es extremadamente cómoda, tranquila y relajante.<br></p><p>Para la comodidad de nuestros huéspedes, presenta:</p><p>- 2 camas individuales convertibles en una doble</p><p>- 01 cama empotrada individual</p><p>- TV LED de 40 ""</p><p>- Cocina con microondas y nevera.</p><p><br>El condominio tiene acceso directo a la playa, con sombrilla y sillas.</p><p><br>Además, puede disfrutar de los siguientes beneficios del resort de forma gratuita:</p><p>- Servicio de limpieza diario</p><p>- Servicio exclusivo de conserjería</p><p>- Amplia área de juegos con piscina natural climatizada al aire libre</p><p>- sauna- Jacuzzis- Academia- Sala de juegos</p><p>- Espacio para niños con monitores para niños de 10 a.m. a 10 p.m.</p><p><br>Hay 3 restaurantes con buena relación calidad-precio en el hotel.</p><p><br>Acceso de invitado:</p><p><br>Acceso permitido para todas las áreas.</p><p><br>Otros comentarios</p><p><br>¡El desayuno no está incluido!</p><p><br>Todos los gastos incurridos con alimentos y bebidas en los bares y restaurantes del hotel deben pagarse cuando se consumen. El hotel no abre la factura para pagar en el check out.</p>'}",active,3,1,2,1,"{'countryCode': 'BR', 'state': 'Santa Catarina', 'stateCode': 'SC', 'city': 'Florianópolis', 'region': 'Jurerê', 'street': 'Alameda César Nascimento', 'streetNumber': '646', 'additional': 'Apto 124', 'zip': '88053-500'}","{'_f_lat': -27.4389433, '_f_lng': -48.4894253}",BRL,5da855e1aea74200108d6768,{'url': 'https://reservas.seazone.com.br/image/d235/5da855e1aea74200108d6768'},True
5db998aa17604600116f9835,WC02F,5ddd80f9aa2309001097b435,"{'_mstitle': {'pt_BR': 'Prédio', 'en_US': 'Building', 'es_ES': 'Edifício', 'pt_PT': 'Prédio'}}",5ab8f8a2f6b2dc2e97f97050,"{'_mstitle': {'pt_BR': 'Apartamento', 'en_US': 'Apartment', 'de_DE': 'Ferienwohnung', 'es_ES': 'Departamento', 'pt_PT': 'Apartamento'}}",entire_home,JBM303,"{'pt_BR': 'Apto com vista incrível de frente p/ o mar JBM303', 'en_US': 'Apartment w/ incredible view facing the sea JBM303', 'es_ES': 'Apartamento con increibles vistas al mar JBM303'}","{'pt_BR': '<p>Apartamento aconchegante em condomínio pé na areia privilegiado em Jurerê. <br> <br>Enquanto toma um café da manhã, você possui uma incrível vista lateral para o mar, digna de uma bela foto ou apenas apreciar o pôr do sol. Ideal para casal ou família com filhos pequenos. <br> <br><br>IMPORTANTE: Para check-in após as 20h há cobrança adicional de taxa de conveniência, então é preciso consultar valores e forma de pagamento com o anfitrião :)<br></p>', 'en_US': '<p>Cozy apartment in a privileged condominium on the sand in Jurerê. <br> <br>While having breakfast, you have an incredible side view of the sea, worthy of a beautiful photo or just enjoying the sunset. Ideal for couple or family with young children. <br><br> <br>IMPORTANT: For check-in after 8pm there is an additional convenience fee, so you need to check values and form of payment with the host :)<br></p>', 'es_ES': '<p>Acogedor apartamento en un condominio privilegiado en la arena en Jurerê. <br> <br>Mientras desayuna, tiene una increíble vista lateral del mar, digna de una hermosa foto o simplemente disfrutando del atardecer. Ideal para pareja o familia con niños pequeños. <br> <br><br>IMPORTANTE: para el check-in después de las 8 p.m. hay una tarifa de conveniencia adicional, por lo que debe verificar los valores y la forma de pago con el anfitrión :)<br></p>'}",active,3,1,2,1,"{'countryCode': 'BR', 'state': 'Santa Catarina', 'stateCode': 'SC', 'city': 'Florianópolis', 'region': 'Jurerê', 'street': 'Rua Jornalista Haroldo Calado', 'streetNumber': '305', 'zip': '88053-600'}","{'_f_lat': -27.4380932, '_f_lng': -48.4835872}",BRL,5dd2f99d9986b90011276035,{'url': 'https://reservas.seazone.com.br/image/d235/5dd2f99d9986b90011276035'},40,True
5f281b4e27571330a960652b,GU01G,5db7449afe23d30011730e41,"{'_mstitle': {'en_US': 'Holiday resort', 'pt_BR': 'Resort de férias', 'es_ES': 'Estancia de vacaciones', 'pt_PT': 'Estância de férias'}}",5ab8f8a2f6b2dc2e97f9704f,"{'_mstitle': {'pt_BR': 'Estúdio', 'en_US': 'Studio', 'de_DE': 'Studio', 'es_ES': 'Estudio', 'pt_PT': 'Estúdio'}}",entire_home,JBV124,"{'pt_BR': 'Lindo Studio Vista Mar em Jurerê JBV124', 'en_US': 'Beautiful Studio Sea View in Jurerê JVB124', 'es_ES': 'Hermoso Studio Vista Mar en Jurerê JVB124'}","{'pt_BR': '<p>Relaxar, desestressar e curtir o sol em um dos lugares mais bonitos do Brasil! </p><p> A partir da sacada, você pode curtir a brisa e a vista de um fim de tarde ou acordar e verificar se o dia está para praia ou para uma piscina aquecida. </p><p> Apartamento com localização perfeita para solteiros ou casais que gostam de curtir o movimento de bares e restaurantes de Jurerê Internacional sem precisar andar muito. </p><p>Ideal também para trazer filhos pequenos e curtir a tranquilidade e benefícios de um resort.</p>', 'en_US': '<p>Relax, de-stress and enjoy the sun in one of the most beautiful places in Brazil! </p><p>From the balcony, you can enjoy the breeze and the view of a late afternoon or wake up and check if the day is for the beach or a heated pool. </p><p>Apartment with perfect location for singles or couples who like to enjoy the movement of bars and restaurants in Jurerê Internacional without having to walk a lot. </p><p>Also ideal for bringing small children and enjoying the tranquility and benefits of a resort.</p>', 'es_ES': '<p>¡Relájate, desestresa y disfruta del sol en uno de los lugares más bellos de Brasil! </p><p>Desde el balcón, puede disfrutar de la brisa y la vista de una tarde o despertarse y comprobar si el día es para la playa o para una piscina climatizada. </p><p>Apartamento con una ubicación perfecta para solteros o parejas que les gusta disfrutar del movimiento de bares y restaurantes en Jurerê Internacional sin tener que caminar mucho. </p><p>También es ideal para traer niños pequeños y disfrutar de la tranquilidad y los beneficios de un resort.</p>'}",active,3,1,2,1,"{'countryCode': 'BR', 'state': 'Santa Catarina', 'stateCode': 'SC', 'city': 'Florianópolis', 'region': 'Jurerê', 'street': 'Alameda César Nascimento', 'streetNumber': '646', 'additional': 'Apto 124', 'zip': '88053-500'}","{'_f_lat': -27.4389433, '_f_lng': -48.4894253}",BRL,606314a96c5f9a079afc7c0c,{'url': 'https://reservas.seazone.com.br/image/d235/606314a96c5f9a079afc7c0c'},True
